{
  "plan_id": "official-birth_copy-v3",
  "requested_service_id": "svc:birth_copy",
  "generated_at": "2026-10-19T14:19:11Z",
  "steps": [
    {
      "order": 1,
      "service_id": "svc:birth_copy",
      "name": "Birth certificate copy: receipt-backed submission",
      "agency": "Registrar General's Department",
      "fee": {
        "value": 120,
        "currency": "LKR",
        "fact_id": "svc:birth_copy:fee"
      },
      "documents": [
        {
          "name": "Completed application",
          "fact_id": "svc:birth_copy:document:0"
        },
        {
          "name": "Payment receipt",
          "fact_id": "svc:birth_copy:document:1"
        }
      ],
      "depends_on": []
    }
  ],
  "provenance": {
    "svc:birth_copy:fee": {
      "source_url": "https://www.rgd.gov.lk/web/index.php/en/services/civil-registration/birth/obtain-certified-copies-translations",
      "retrieved_at": "2026-10-19T14:19:11Z"
    },
    "svc:birth_copy:document:0": {
      "source_url": "https://www.rgd.gov.lk/web/index.php/en/services/civil-registration/birth/obtain-certified-copies-translations",
      "retrieved_at": "2026-10-19T14:19:11Z"
    },
    "svc:birth_copy:document:1": {
      "source_url": "https://www.rgd.gov.lk/web/index.php/en/services/civil-registration/birth/obtain-certified-copies-translations",
      "retrieved_at": "2026-10-19T14:19:11Z"
    }
  }
}
